{
  "id": "jesus_literary_map_v1",
  "label_ru": "Литературный маршрут Иисуса (гео-карта)",
  "confidence": "literary",
  "disclaimer_ru": "Координаты — современные ориентиры мест из евангельской географии, не firm-траектория путешествий. Порядок stops = literary itinerary (Мф/Мк/Лк/Ин), не критическая биография.",
  "source_ids": [
    "synoptic_gospels",
    "johannine_gospel",
    "modern_handbook"
  ],
  "stops": [
    {
      "place_id": "jordan_valley",
      "lat": 31.8372,
      "lon": 35.5465,
      "geo_note_ru": "Река Иордан. Здесь по Евангелию Иоанн крестил Иисуса. Где именно на берегу это было — точно неизвестно."
    },
    {
      "place_id": "cana",
      "lat": 32.7466,
      "lon": 35.3388,
      "geo_note_ru": "Селение в Галилее. По преданию здесь был свадебный пир, где вода стала вином."
    },
    {
      "place_id": "capernaum",
      "lat": 32.8803,
      "lon": 35.575,
      "geo_note_ru": "Городок на берегу Галилейского озера. Важный центр проповеди в Галилее."
    },
    {
      "place_id": "nazareth",
      "lat": 32.6996,
      "lon": 35.3035,
      "geo_note_ru": "Город в холмах Галилеи. В предании — родной город Иисуса."
    },
    {
      "place_id": "nain",
      "lat": 32.6308,
      "lon": 35.3494,
      "geo_note_ru": "Небольшое селение у холмов. В Евангелии от Луки здесь рассказ о воскрешении сына вдовы."
    },
    {
      "place_id": "sea_of_galilee",
      "lat": 32.815,
      "lon": 35.59,
      "geo_note_ru": "Галилейское озеро. Место многих рассказов о лодке, буре и хождении по воде."
    },
    {
      "place_id": "bethsaida",
      "lat": 32.91,
      "lon": 35.63,
      "geo_note_ru": "Местность у северного берега озера. Связана с рассказами о насыщении народа."
    },
    {
      "place_id": "decapolis",
      "lat": 32.826,
      "lon": 35.651,
      "geo_note_ru": "Восточный берег озера, область Десятиградия. Здесь рассказ о исцелении одержимого."
    },
    {
      "place_id": "tyre_region",
      "lat": 33.2705,
      "lon": 35.196,
      "geo_note_ru": "Побережье у Тира и Сидона. Северный край маршрута в Евангелиях."
    },
    {
      "place_id": "caesarea_philippi",
      "lat": 33.2486,
      "lon": 35.6944,
      "geo_note_ru": "У подножия гор на севере. Здесь ученики отвечают на вопрос, кто такой Иисус."
    },
    {
      "place_id": "samaria",
      "lat": 32.2764,
      "lon": 35.1903,
      "geo_note_ru": "Земля между Галилеей и Иудеей. Здесь рассказ о беседе у колодца."
    },
    {
      "place_id": "jericho",
      "lat": 31.855,
      "lon": 35.461,
      "geo_note_ru": "Город в долине у дороги к Иерусалиму. Здесь рассказы о слепых и о Закхее."
    },
    {
      "place_id": "bethany",
      "lat": 31.7714,
      "lon": 35.2611,
      "geo_note_ru": "Селение рядом с Иерусалимом. Дом друзей Иисуса; рассказ о Лазаре."
    },
    {
      "place_id": "jerusalem",
      "lat": 31.778,
      "lon": 35.2354,
      "geo_note_ru": "Главный город Иудеи. Храм, последние дни и центр евангельского рассказа."
    }
  ]
}
